{
  "version": "2026.05.04.0951",
  "releaseDate": "2026-05-04T09:51:52.205002+00:00",
  "author": "scrape_rules.py",
  "compatibilityVersion": "1",
  "changelog": [
    {
      "version": "2026.05.04.0951",
      "date": "2026-05-04T09:51:52.205002+00:00",
      "changes": [
        "Автоматический снимок раздела «Правила форума»"
      ]
    }
  ],
  "rules": [
    {
      "id": "forum.1.1",
      "number": "1.1",
      "title": "Данные правила являются обязательными для ознакомления",
      "category": "Форум",
      "text": "Данные правила являются обязательными для ознакомления",
      "explanation": null,
      "examples": [],
      "exceptions": [],
      "punishments": [],
      "linkedPunishments": [],
      "relatedTemplates": [],
      "tags": [
        "данные",
        "правила",
        "являются",
        "обязательными",
        "ознакомления"
      ],
      "source": "forum:forum:https://forum.majestic-rp.ru/threads/pravila-foruma.5245/",
      "status": "Active",
      "updatedAt": "2026-05-04T09:51:52.203750+00:00"
    },
    {
      "id": "forum.1.2",
      "number": "1.2",
      "title": "Модератор форума согласно регламентом самостоятельно определяют наказание за нарушение дан…",
      "category": "Форум",
      "text": "Модератор форума согласно регламентом самостоятельно определяют наказание за нарушение данных правил пользователями",
      "explanation": null,
      "examples": [],
      "exceptions": [],
      "punishments": [],
      "linkedPunishments": [],
      "relatedTemplates": [],
      "tags": [
        "модератор",
        "форума",
        "согласно",
        "регламентом",
        "самостоятельно",
        "определяют"
      ],
      "source": "forum:forum:https://forum.majestic-rp.ru/threads/pravila-foruma.5245/",
      "status": "Active",
      "updatedAt": "2026-05-04T09:51:52.203750+00:00"
    },
    {
      "id": "forum.1.3",
      "number": "1.3",
      "title": "Незнание правил не освобождает от ответственности",
      "category": "Форум",
      "text": "Незнание правил не освобождает от ответственности",
      "explanation": null,
      "examples": [],
      "exceptions": [],
      "punishments": [],
      "linkedPunishments": [],
      "relatedTemplates": [],
      "tags": [
        "незнание",
        "правил",
        "освобождает",
        "ответственности"
      ],
      "source": "forum:forum:https://forum.majestic-rp.ru/threads/pravila-foruma.5245/",
      "status": "Active",
      "updatedAt": "2026-05-04T09:51:52.203750+00:00"
    },
    {
      "id": "forum.1.4",
      "number": "1.4",
      "title": "Данные правила могут быть изменены и дополнены",
      "category": "Форум",
      "text": "Данные правила могут быть изменены и дополнены",
      "explanation": null,
      "examples": [],
      "exceptions": [],
      "punishments": [],
      "linkedPunishments": [],
      "relatedTemplates": [],
      "tags": [
        "данные",
        "правила",
        "могут",
        "изменены",
        "дополнены"
      ],
      "source": "forum:forum:https://forum.majestic-rp.ru/threads/pravila-foruma.5245/",
      "status": "Active",
      "updatedAt": "2026-05-04T09:51:52.203750+00:00"
    },
    {
      "id": "forum.1.5",
      "number": "1.5",
      "title": "В некоторых разделах допускается создание локальных актов, которые устанавливают дополните…",
      "category": "Форум",
      "text": "В некоторых разделах допускается создание локальных актов, которые устанавливают дополнительные правила для данного раздела",
      "explanation": null,
      "examples": [],
      "exceptions": [],
      "punishments": [],
      "linkedPunishments": [],
      "relatedTemplates": [],
      "tags": [
        "некоторых",
        "разделах",
        "допускается",
        "создание",
        "локальных",
        "актов"
      ],
      "source": "forum:forum:https://forum.majestic-rp.ru/threads/pravila-foruma.5245/",
      "status": "Active",
      "updatedAt": "2026-05-04T09:51:52.203750+00:00"
    },
    {
      "id": "forum.1.6",
      "number": "1.6",
      "title": "Ответственность за аккаунт и весь контент несёт исключительно владелец аккаунта",
      "category": "Форум",
      "text": "Ответственность за аккаунт и весь контент несёт исключительно владелец аккаунта",
      "explanation": null,
      "examples": [],
      "exceptions": [],
      "punishments": [],
      "linkedPunishments": [],
      "relatedTemplates": [],
      "tags": [
        "ответственность",
        "аккаунт",
        "весь",
        "контент",
        "исключительно",
        "владелец"
      ],
      "source": "forum:forum:https://forum.majestic-rp.ru/threads/pravila-foruma.5245/",
      "status": "Active",
      "updatedAt": "2026-05-04T09:51:52.203750+00:00"
    },
    {
      "id": "forum.1.7",
      "number": "1.7",
      "title": "Модератор форума вправе сам назначать срок через который истекают баллы",
      "category": "Форум",
      "text": "Модератор форума вправе сам назначать срок через который истекают баллы",
      "explanation": null,
      "examples": [],
      "exceptions": [],
      "punishments": [],
      "linkedPunishments": [],
      "relatedTemplates": [],
      "tags": [
        "модератор",
        "форума",
        "вправе",
        "назначать",
        "срок",
        "через"
      ],
      "source": "forum:forum:https://forum.majestic-rp.ru/threads/pravila-foruma.5245/",
      "status": "Active",
      "updatedAt": "2026-05-04T09:51:52.203750+00:00"
    },
    {
      "id": "forum.1.8",
      "number": "1.8",
      "title": "Частые нарушения форумных правил могут привести к игровой блокировке",
      "category": "Форум",
      "text": "Частые нарушения форумных правил могут привести к игровой блокировке",
      "explanation": null,
      "examples": [],
      "exceptions": [],
      "punishments": [],
      "linkedPunishments": [],
      "relatedTemplates": [],
      "tags": [
        "частые",
        "нарушения",
        "форумных",
        "правил",
        "могут",
        "привести"
      ],
      "source": "forum:forum:https://forum.majestic-rp.ru/threads/pravila-foruma.5245/",
      "status": "Active",
      "updatedAt": "2026-05-04T09:51:52.203750+00:00"
    },
    {
      "id": "forum.1.9",
      "number": "1.9",
      "title": "На форуме действует прецедентная система правил",
      "category": "Форум",
      "text": "На форуме действует прецедентная система правил. (Если пользователь совершил правонарушение, которое не описано в правилах форума, то он может быть наказан с разрешения Чиф форума/ЗГА/ГА. Сделано это не с целью выдумывать правила \"на ходу\" и наказывать по ним, а потому, что все мы люди, могли что-то и забыть или не учесть)",
      "explanation": null,
      "examples": [],
      "exceptions": [],
      "punishments": [],
      "linkedPunishments": [],
      "relatedTemplates": [],
      "tags": [
        "форуме",
        "действует",
        "прецедентная",
        "система",
        "правил",
        "пользователь"
      ],
      "source": "forum:forum:https://forum.majestic-rp.ru/threads/pravila-foruma.5245/",
      "status": "Active",
      "updatedAt": "2026-05-04T09:51:52.203750+00:00"
    },
    {
      "id": "forum.1.10",
      "number": "1.10",
      "title": "Администрация/модерация проекта вправе на свое усмотрение удалить/выделить публичным наруш…",
      "category": "Форум",
      "text": "Администрация/модерация проекта вправе на свое усмотрение удалить/выделить публичным нарушением, контент нарушающий регламент форума",
      "explanation": "темы не несущие серьезного нарушения удаляются только с разрешения Чиф форума/Куратора раздела/ЗГА/ГА.",
      "examples": [],
      "exceptions": [],
      "punishments": [],
      "linkedPunishments": [],
      "relatedTemplates": [],
      "tags": [
        "администрация",
        "модерация",
        "проекта",
        "вправе",
        "свое",
        "усмотрение"
      ],
      "source": "forum:forum:https://forum.majestic-rp.ru/threads/pravila-foruma.5245/",
      "status": "Active",
      "updatedAt": "2026-05-04T09:51:52.203750+00:00"
    },
    {
      "id": "forum.2.1",
      "number": "2.1",
      "title": "Запрещено продавать/передавать аккаунт третьим лицам",
      "category": "Форум",
      "text": "Запрещено продавать/передавать аккаунт третьим лицам",
      "explanation": null,
      "examples": [],
      "exceptions": [],
      "punishments": [
        {
          "type": "Блокировка аккаунта",
          "duration": null,
          "reason": null
        }
      ],
      "linkedPunishments": [],
      "relatedTemplates": [],
      "tags": [
        "запрещено",
        "продавать",
        "передавать",
        "аккаунт",
        "третьим",
        "лицам"
      ],
      "source": "forum:forum:https://forum.majestic-rp.ru/threads/pravila-foruma.5245/",
      "status": "Active",
      "updatedAt": "2026-05-04T09:51:52.203750+00:00"
    },
    {
      "id": "forum.2.2",
      "number": "2.2",
      "title": "Запрещено представляться другим человеком на форуме",
      "category": "Форум",
      "text": "Запрещено представляться другим человеком на форуме",
      "explanation": null,
      "examples": [],
      "exceptions": [],
      "punishments": [
        {
          "type": "Ban",
          "duration": "5 - 30 дней",
          "reason": null
        },
        {
          "type": "Блокировка аккаунта",
          "duration": null,
          "reason": null
        }
      ],
      "linkedPunishments": [
        {
          "punishmentId": "punishment_ban",
          "presetDuration": "5 - 30 дней",
          "presetReason": null,
          "note": "Авто по форуму"
        }
      ],
      "relatedTemplates": [],
      "tags": [
        "запрещено",
        "представляться",
        "другим",
        "человеком",
        "форуме"
      ],
      "source": "forum:forum:https://forum.majestic-rp.ru/threads/pravila-foruma.5245/",
      "status": "Active",